experiment_id,description,model,augmentation,loss_function,learning_rate,batch_size,epochs,train_loss,val_loss,test_dice,test_iou,checkpoint_file,notes
E1,Baseline BatchNorm UNet with moderate augmentation,UNet,moderate,BCE+Dice,0.001,8,20,0.8449,0.8416,0.3817,0.3343,best_model_E1.pth,Initial baseline results
E2,No augmentation,UNet,none,BCE+Dice,0.001,8,20,0.8055,0.8551,0.3801,0.3365,best_model_E2.pth,Compare effect of augmentation
E3,Stronger augmentation,UNet,strong,BCE+Dice,0.001,8,20,0.8964,0.8964,0.2516,0.2097,best_model_E3.pth,Test stronger augmentation with Gaussian Noise
E4,BCE only loss,UNet,moderate,BCE,0.001,8,20,0.0195,0.025,0.6827,0.6514,best_model_E4.pth,Compare loss functions (new baseline)
E5,Dice only loss,UNet,moderate,Dice,0.001,8,20,0.8278,0.8336,0.2293,0.1867,best_model_E4.pth.pth,Compare loss functions
E6,Lower learning rate,UNet,moderate,BCE,0.0001,8,20,0.012,0.018,0.8179,0.7814,best_model_lr_1e4.pth,Compare optimization speed/stability (switched to BCE alone because it turned out to be the best)
E7,Middle ground learning rate,UNet,moderate,BCE,0.0005,8,20,,,,,best_model_lr_1e4.pth,Compare optimization speed/stability (switched to BCE alone because it turned out to be the best) 